/**
* @defgroup Mysql语法
* @{
*/

/**
@verbatim
1、类型转换有两种方法，如下：
	mysql> select cast('123' as unsigned integer);
	+---------------------------------+
	| cast('123' as unsigned integer) |
	+---------------------------------+
	|                             123 |
	+---------------------------------+
	1 row in set
	
	mysql> select convert('123',unsigned integer);
	+---------------------------------+
	| convert('123',unsigned integer) |
	+---------------------------------+
	|                             123 |
	+---------------------------------+
	1 row in set
2、需要注意的是，目标类型只能是下面的类型。
	BINARY[(N)] 
	CHAR[(N)] 
	DATE 
	DATETIME 
	DECIMAL 
	SIGNED [INTEGER] 
	TIME 
	UNSIGNED [INTEGER] 
3、注意：在Mysql中float，double是非标准的数据类型，在数据库中保存的是近似值。
	而decimal是标准的数据类型，Mysql内部用字符串保存decimal，精确地保存它们的值。
4、在mysql中，数值作为字符串，字符串作为数值，不需要特殊转化，mysql会自动识别，并转化，如下：
	mysql> select 12.1+13.4;
	+-----------+
	| 12.1+13.4 |
	+-----------+
	| 25.5      |
	+-----------+
	1 row in set
	
	mysql> select '12.1'+'13.4';
	+---------------+
	| '12.1'+'13.4' |
	+---------------+
	|          25.5 |
	+---------------+
	1 row in set
	
	mysql> select concat('12.1','13.4');
	+-----------------------+
	| concat('12.1','13.4') |
	+-----------------------+
	| 12.113.4              |
	+-----------------------+
	1 row in set
	
	mysql> select concat(12.1,13.4);
	+-------------------+
	| concat(12.1,13.4) |
	+-------------------+
	| 12.113.4          |
	+-------------------+
	1 row in set
	注意：字符串转换为数值失败，当做0来处理，如下：
	mysql> select '12.1'+'aaa';
	+--------------+
	| '12.1'+'aaa' |
	+--------------+
	|         12.1 |
	+--------------+
	1 row in set
5、数值作为字符串，字符串作为数值，不需要特殊转化，如下：
	mysql> desc t1;
	+-------+--------------+------+-----+---------+-------+
	| Field | Type         | Null | Key | Default | Extra |
	+-------+--------------+------+-----+---------+-------+
	| c1    | int(11)      | NO   |     | 0       |       |
	| c2    | double       | YES  |     | NULL    |       |
	| c3    | varchar(100) | YES  |     | NULL    |       |
	+-------+--------------+------+-----+---------+-------+
	3 rows in set
	
	mysql> select * from t1;
	+----+-------+-------+
	| c1 | c2    | c3    |
	+----+-------+-------+
	|  1 | 12.35 | 12345 |
	+----+-------+-------+
	1 row in set
	
	// 下面的update语句，数值作为字符串，字符串作为数值，没有问题。
	mysql> update t1 set c2='25.6',c3=100 where c1='1';
	Query OK, 1 row affected
	Rows matched: 1  Changed: 1  Warnings: 0
	
	mysql> select * from t1;
	+----+------+-----+
	| c1 | c2   | c3  |
	+----+------+-----+
	|  1 | 25.6 | 100 |
	+----+------+-----+
	1 row in set
@endverbatim
*/
类型转换;


/** @} */

